indices,y_error_pred,label,sentence,probability
1623,时政,家居,各城市领导分别谈对林业产业维权看法 &nbsp;主持人：广东省知识产权局对林业产业国际维权十分重视，并给予了大力支持，下面有请广东省知识产权局副局长郑良生先生发言。郑良生：各位领导大家上午好，我代表广东省知识产权局对本次研讨会成功召开表示热烈的祝贺。刚才听了贾局长的重要讲话以及各位专家的发言，特别是听了燕加隆公司所取得的国际维权情况的汇报，很有感触。对于燕加隆公司在国际维权这件事，广东省知识产权局一直非常关注，也真心的希望他们可以打赢这场国际商战，前不久燕加隆告诉我，赢了，燕加隆赢了官司，在这里我对燕加隆的成功和胜利表示热烈的祝贺。下面我想就燕加隆公司在国际维权当中所取得的成绩讲几点看法：一，燕加隆胜诉的关键就是燕加隆一拍即合技术具有知识产权。用广东人讲这是正货，不是假货，正因为是具有知识产权的技术，所以才可以在国际上站住脚；第二，燕加隆胜诉的成本就是他们重视创新，重视知识产权，把知识产权视为企业的生命，创新是知识产权的手段，而知识产权是保持创新的法律保障；三，燕加隆给予我们的经验是非常可贵的，在他们取得成功的同时，也给予我们一些重要的启示，第一，知识产权是企业走出去的战略法宝，是企业开拓国际市场的一把利剑；第二，在企业建立知识产权制度是现代企业制度发展的必然；三，企业要发展，必须重视技术的研发和创新，从而创造出自己的知识产权，形成自己的核心技术，占领产业发展的制高点；四，要有一只懂得国际知识产权的队伍，第五，进行国际知识产权的研发，有计划的进行战略布局，这一点我认为我们要学习发达国家企业的经验，例如摩托摩拉公司，他们的手机在中国上市前已经在中国申请了很多的专利；第六，遇到国际贸易摩擦时要积极应诉，敢于应诉，勇于维护自己的利益，积极不是蛮干，要像燕加隆公司一样，有胆有识，有理有据，研究制定应对的策略。以上几点看法是我认为的看法，仅供参考，谢谢大家！主持人：湖北省十分重视科技创新，省林业局率先组建了中国首家低碳经济产业园，引入了像燕加隆一样具有核心知识产权的企业，参加会议的除了林业厅还有一些有关的县、镇领导也参加了，体现了对知识产权的支持，下面由湖北省林业局代表陈先生发言。陈先生：各位领导、各位来宾大家好，今天发言的应该是我们王局长，但是今天下午他要参加一个调研，他临走的时候委托我代替他发言，所以我今天代表王海涛局长，代表湖北的地板企业向燕加隆在加拿大、美国337当中的胜诉表示热烈的祝贺，这不仅长了燕加隆的志气，更长了中国民族企业的志气，这是燕加隆公司掌握产业核心技术，前不久我省在湖北成立了低碳经济产业园，燕加隆公司作为这个园区的龙头企业，牵头企业，投资数亿元发展低碳经济，在这个方面，为发展低碳经济改革方面真正的起到了龙头带动作用，燕加隆一拍即合的专利技术不仅在于他是产业核心技术，也在于他的环保核心技术，不仅如此，燕加隆公司还在湖北发展产业工业，营造工业园40多万亩，有利的支持了低碳经济的发展。燕加隆企业的胜诉，为我们的所有的民营企业带了一个好头，树立了一个榜样。最后希望燕加隆公司进一步注重产品的质量，加大国际市场的力度，进一步研发新产品，推出新技术，获得新专利。把企业做大做强，在国际竞争中仍然立于不败之地，谢谢大家！主持人：林业产业知识创新，国际维权的问题一直得到国家林业局的重视，现在有请国家林业局科技发展中心常务副主任林先生发言。林先生：非常感谢主办方能够在这里为我们行业举办这次研讨会，代表国家林业局科技发展中心科技司对本次会议的主办表示衷心的感谢，同时也感谢大会为我提供一个发言的机会。在这次会议上非常荣幸，也非常高兴的听到燕加隆再次在国际素取得了胜利，燕加隆公司是我们中国，尤其是中国林业企业在国际上参加国际贸易诉讼取得成功的比较少的范例之一，在林业行业当中取得了巨大的振动，我们科技口，科技界对这个问题十分的关注，受到了巨大的鼓舞，在此请允许我代表林业科技战线的全体员工，对燕加隆再次取得国际当中的胜诉表示热烈的祝贺。在世界经济日益全球化的大背景下，在知识经济飞速发展的今天，知识产权是一个核心竞争力的体现，为了应对全球技术贸易摩擦，为了提升我国经济、社会的发展水平和竞争实力。国务院在去年颁布了《国家知识产权战略纲要》，标志着知识产权战略已经成为国家层面进行实施，预示着我们国家的竞争和全球化的竞争上了一个新的台阶。在这里我简单介绍一下林业知识产权管理的有关情况。首先，介绍一个概念，就是林业知识产权包括哪些内容，为了进一步贯彻国家知识产权发展纲要，同时组织六个专题组在进行广泛的调研，争取在短期内制定，颁布出林业知识产权战略纲要。林业知识产权战略纲要主要包括这么几个部分，一个是专利，据我们了解和在数据库的统计有效记录，林业的专利数量是六万多件，其中近一半都是有效的管理，都是目前有效的管理，在全国专利应用总数的2%，整体来说还是不多的。第二项就是体现行业特色的新品种，中国是一个资源大国，也是生物资源非常丰富的国家，经过人工的治理开发，国家出台了一些新的政策，要经过授权、申请，测试、审查确认的，这部分的林业新品种目前已经颁布了四批，供78个，130多件，即将颁布，如果可以颁布的话，在今年年底，明年年初总数量大概在133个水准，达到500件左右。第三个就是体验行业特色的，比如说大家熟知的一些，我们和农业部共同管理的生物、植物、动物这些拥有地理标识的产品，林业这边主要是从林木，果树。再有就是体现林业知识产权管理范围，就是生物遗传资源，我们国家的生物遗传资源十分的丰富，这部分森林林产资源占全球的30%多，我们国家现在是生物遗传的进出口交易大国，通过人的治理、开发、应用；最近12月1日，国家林业局正式批准，将林业行业知识产权工作归到科技中心的职能部门下，为此还专门设立了一个执法管理处，主要负责林业新品种，专利，生物遗传方面监督管理形成执法，目前正在拟定的力量，在行业省区也要相应的建立执法部门。这次参加这个会议也是一个学习的机会，非常感谢主办方产业协会、林产工业协会，燕加隆公司给我们提供这个机会，在这里我们有两个处长在这里，将来作为行业的知识产权管理工作，既要对上面连接国家知识产权局、工商局之外，对内要做好协调，对林业企业做好服务性的工作。最后我简单介绍一下近期将开展的三项工作，主要是在以往工作的基础上，进一步加大力量，从贯彻国家知识产权战略纲要的角度，认真组织行业内的知识产权的工作，重点强化林业知识产权保护，促进林业自主创新和产业发展，抓住实施国家知识产权纲要的时机，抓住林业生物遗传资源等主要产品的保护和应用，提高林业知识产权的质量和核心竞争力。尽快的出台并落实国家林业局贯彻实施国家知识产权战略纲要的指导意见，加强行业指导和协调推进，采取相应的支持和激励措施鼓励自主创新，提升林业产业的整体实力；第二，联系建立林业保护的机制，重点开发出口林产品和知识产权的平台，为林业企业有效的支持产权壁垒提供信息和技术，这个工作主要依托协会的力量，学校的力量，科研的力量做。第三，是要推动建立各种形式的知识产权，开发和保护，开展林业科研单位，企业、单位试点，在此告诉大家一个消息，我们以将燕加隆公司，林科院木材工业研究所叶所长他们，还有大亚集团三家列为林业知识产权的试点单位上报到国家知识产权局，近期就应该批准下来了。我们想借这个机会提升我们的形象，林业知识产权这块的工作量，虽然刚刚起步，当然我们想开好头，高效一点，所以慎重的选择了三家，一旦成功，将获得国家的一些支持。重点是要提高自主知识产权和抵制国际贸易壁垒，推动林产业的发展，最后感谢主办方，认识大家非常高兴，我们行业知识产权管理部门将全力做好服务性的工作，密切配合协会、学会、企业集团、科研单位，以及林业全行业的管理部门，做好我们林业知识产权的保护和管理工作，谢谢大家！主持人：国家知识产权管理部门一直重视这项工作，现在我们欢迎中国专利保护协会副会长兼秘书长肖鲁青女士发言。肖鲁青：各位领导、各位专家大家好，再有两天2009年就过去了，2009年是不平凡的一年，温家宝总理接受新华社记者采访时说过去的这一年是惊心动魄的一年，金融危机当中企业是首当其冲遭受了很大的冲击，中央采取了措施，使中国的经济出现了企稳，一些企业突破了金融危机的影响和国际的打压，出现了良好的发展局面。今天在这里研讨中国林业企业国际维权问题，从一个侧面真实的反映了这个情形，深圳燕加隆公司多年来在市场上维护自己的知识产权，并取得胜利，成为我国企业海外维权成功的范例，因此，举办这么一个会议是具有非常重要的和深远的影响意义。首先反映了我国的企业在国际竞争中不断的发展壮大，我们国家拥有一批自主知识产权的企业，通过自己的努力，实现了一定的目标，也体现了中央领导说的创新可以赢得实力，创新可以赢得发展，创新可以赢得尊严的深刻的道理，在经济全球化的时代，世界的竞争最根本的还是知识产权的竞争，在这一点上，燕加隆就是一个榜样，他们发明的一拍即合地板锁扣技术是一个新兴的专利，它解决了地板的核心空白点，实现了核心的创新，满足了市场的需要，打破了国外市场的垄断，实现了知识产权的价值。其次我们通过燕加隆国际维权的艰难历程也看到，我们企业都面临着这样的挑战，中国的企业要想走向国际市场，必须要做好知识产权的大文章，随着我们国家的企业越来越多的进入国际市场，中国的企业在海外遇到的知识产权诉讼越来越频繁，美国的337调查已经不是什么新鲜事了，核心也是知识产权权利是否得到了侵犯，目前我们国家的企业95%的涉外专利诉讼都发生在美国，发达国家企业运用知识产权壁垒进行大量的侵权诉讼目的很清楚，就是排斥和削弱国外的竞争对手。发达国家的贸易保护主义日益加剧，维护他们的市场垄断和知识产权的优势，为了避免我们企业在知识产权战争中的高额代价，企业建立知识产权的经营策略，管理技术制订海外知识产权的管理应对，都是有效的措施，燕加隆可以通过核心技术，通过知识产权打破国外产业的垄断，走向国际市场也为我们广大的企业提供了一个典型的案例。燕加隆企业维权胜利也告诉广大企业，面对国外企业的侵权诉讼，我们不要迷信国外的先进技术，不能只采取回避的态度，应该敢于积极应诉，学会一定的规则，聘请有经验的律师应诉。近年来我们的企业也相继在国际侵权诉讼中打赢了官司，给我们中国的企业增加了信心和决心，同时也积累了国际诉讼方面的经验，希望更多的中国企业能够以燕加隆公司为榜样，努力的研发自主核心专利技术，不断的增强企业的竞争力，使更多的中国产品走向国际市场，国务院在去年六月五日颁布《国家知识产权战略》我们也相信各级政府也将为企业提供更好的法制环境和市场环境，促进越来越多的企业把知识产权战略融入到企业自身发展的战略当中，提高企业的知识产权，创造、应用、保护、管理能力，推动创新性国家的建设，谢谢大家！主持人：我们刚才以燕加隆国际维权经历为案例，在国际贸易、知识产权等多角度进行了研讨，各位专家、来宾都提出了非常多的建设性的意见和建议，有关国际林业产业维权问题，本次研讨会是一个开始，希望各界，各方面进一步重视和关心林业企业国际维权问题。本次会议就到这里。   ,0.564180850982666
1658,财经,房产,银监会：综合授信类个人贷款业务将收紧本报讯记者刘薇报道：银监会周三发布了《个人贷款管理暂行办法(征求意见稿)》，对个人贷款实行支付管理。如果正式出台，这将是我国首部个人贷款管理法规。银行人士表示，总体来看，《暂行办法》对个人贷款业务没有太多新的限定，但细化到银行具体业务，则有一些贷款品种可能会加强审核，收紧门槛，诸如此前非常火爆的综合授信类个人贷款业务。《暂行办法》主要内容是，规定银行不得发放无指定用途的贷款，明确实行贷款人受托支付或借款人自主支付的方式对贷款资金进行管理和控制。重申银行在发放个人贷款时须坚持面谈、面签制度，确保贷款的真实性，以防范虚假按揭等风险。由于办法不针对个人贷款业务品种申请设置额外条件，因此个人获得贷款的门槛并没有被抬高。记者昨日采访多位银行信贷部门人士，他们表示，其实目前大部分个人贷款业务如房贷、车贷等都是实行受托支付，即贷款人根据借款人的提款申请和支付委托，将贷款资金直接支付给符合合同约定用途的借款人交易对象。这样做的好处，一方面能够有效监控贷款按约定用途使用，防范贷款挪用风险；另一方面也可防止“顶冒名”等违规损害借款人利益的行为，切实保护借款人合法权益。如今受《暂行办法》影响较大的，则是市面上一度火爆的个人综合授信类贷款。这类贷款通常表现为“房产一次抵押，贷款额度多次循环使用”，如很受市民欢迎的“循环贷”、“随借随还”等，有的银行在开办这类业务时放得较为宽松，只要首次审核通过，以后的贷款申请甚至可以通过网上银行等自助方式办理，无需再经过相对复杂的审核手续，这就意味着在初次审核通过后，借款人就不用再到银行面谈、面签，便可能获得贷款。“这其中的确存在着无法监控贷款真实去向的可能。”某国有大行支行行长称。而一家股份制银行信贷部门人士则坦言，在《管理办法》出台后，该行相对宽松的审核制度很可能需要作出调整，比如采取措施加强对贷款用途的审查，自助方式也许会取消。 我要评论,0.48447269201278687
1660,时政,房产,城建系统两年万余人涉案新华社讯 最高人民检察院昨天通报了查办城镇建设领域商业贿赂犯罪案件情况。据悉，2007年至2008年两年间，全国检察机关共立案查办城镇建设领域商业贿赂犯罪案件9374件、10043人，其中，涉及国家公务员和处级以上干部要案较多，大案所占比例高，涉案金额大，窝案串案突出。受贿案占立案数的77.3%2007年以来，为认真贯彻落实中央决策部署， 深入推进治理商业贿赂专项工作，最高人民检察院针对工程建设、土地出让、房地产开发等领域官商勾结、权钱交易突出等问题， 组织全国检察机关开展集中查办城镇建设领域商业贿赂犯罪案件工作，成效明显。2007年、2008年两年间， 共立案查办的9374件10043人， 分别占查办商业贿赂犯罪立案总数的45.3%和44.5%。其中，受贿7250件，占查办城镇建设领域商业贿赂犯罪案件立案数的77.3%；行贿1879件，占20%。此外，还有单位受贿61件，对单位行贿22件，单位行贿92件，介绍贿赂70件。案件主要发生在城建领域案件主要发生在城镇基础设施建设、房地产开发、单位所属工程建设、土地出让等领域。据统计，发生在这几个领域的案件7990件，占城镇建设领域商业贿赂犯罪案件总数的85.24%。其中，城镇基础设施建设2999件，单位所属工程建设2881件，土地出让1110件，房地产开发1000件。公务员和处以上干部涉案多据悉，国家公务员和处级以上干部涉案较多，两年共立案查办国家公务员3567人， 占立案总人数的35.5%。其中，党政领导663人，土地管理部门501人， 建设部门705人。查办处级以上要案1266人，占12.6%。涉案金额大大案所占比例高从查办案件情况看， 大案所占比例高，涉案金额大。城镇建设领域商业贿赂犯罪案件涉案总金额18.75亿余元，平均个案涉案金额达20万余元。共查办5万元以上大案6976件，占总数的74.4%；其中，50万元以上案件784件，占41.9%。案件涉及城建各个环节在办案中， 检察机关往往是查处一案、带出一窝、牵出一串，许多案件涉及工程立项、规划、审批、招投标、发包分包、采购、资金拨付、交纳税费和施工管理等多个环节。如广州市检察机关在查办“ 北江大堤加固达标工程”涉嫌职务犯罪案件时， 在该工程中深挖出窝案串案10件10人，其中处级要案2人，且均为大案。隋笑飞我要评论,0.6122307181358337
1696,游戏,家居,挑“T”总动员 获奖作品展示第三周周人气奖(1名)获奖作品名称：满口香扣肉 (编号 69672)作品说明：[原料/调料]五花肉、葱、姜、蜂蜜少许、大料(八角)。[制作流程]1、五花肉煮到8分熟，筷子扎透没有血水冒出就可以了，取出五花肉控干水，然后在肉皮上抹上一层蜂蜜；2、锅里倒入少许油，把抹蜂蜜的肉皮放到锅里煎；3、煎至黑红色即可，注意煎的时候要保护好自己，因为油崩的很厉害，最好拿锅盖挡一下；4、把煎好的五花肉切成薄厚均匀的肉片，肉皮朝下摆放到大碗里；5、葱两段改成丝，姜三片，大料两个；6、把葱、姜、大料、糖、盐、酱油、鸡精放到大碗里，上锅蒸，冷水入锅，水开后计时，一小时后就可以了，香香的扣肉就做好了。第三周周创意奖(1名)获奖作品名称：小煎鸡 (编号 69648) 作品说明：[原料/调料]鸡脯肉150克，冬笋100克，泡辣椒、芹黄25克[制作流程]1.鸡肉切条，用盐、水淀粉上浆。2.水淀粉、料酒、盐、胡椒粉和醋在碗中兑成味汁，电磁炉大火用花生油将鸡条炒散，放入葱姜、蒜片和泡辣椒，炒出香味后放入冬笋条、芹菜，下入兑好的碗汁，翻吵几下即成。,0.8116324543952942
1763,房产,财经,12亿元抄底地产股 中邮系圈地路线图曝光每经记者 李娜 发自上海上市公司2008年年报将中邮系基金扎根于地产股的根根须须一一曝光，多只地产股的前十大流通股股东中出现了中邮系基金的身影。沉寂了一年的中邮系基金再一次以一种“偏激”的方式强势回归。伴随着地产股2008年年报的接连披露，中邮系基金越来越频繁地曝光于镁光灯前，多家地产股的前十大流通股股东均有中邮系基金的身影，若以2008年12月31日收盘价简单计算，中邮系基金抄底这些地产股的资金高达12.05亿元。毫无疑问，中邮系基金始于去年下半年的重仓地产股的决策相当成功，在吸引坊间艳羡的目光的同时，也将自家腰包快速增厚。数据显示，自年初至本周三，中邮核心优选领跑所有股票型基金，涨幅高达35%，远远超过股票型基金净值18%的平均涨幅。地产股年报频现中邮系房地产，用国民经济的引擎之一来形容一点儿也不为过。自去年房地产市场的成交量持续萎缩后，对地产行业的关切之情便频频出现在基金经理的季度工作报告中，出现在基金经理的访谈中。与其他徘徊犹豫的基金公司相比，中邮系基金则表现异常坚决，选择提前进场等待。自去年三季度率先加仓地产股后，在接下来的四季度，中邮系对地产股的加仓力度丝毫不减，据已发布的房地产上市公司年报显示，多家地产股的前十大流通股股东均有中邮系基金的身影。据Wind统计数据显示，截至昨日，目前已披露的20多家房地产上市公司中，中邮系出现在了5家地产上市公司的前十大流通股股东中。泛海建设2008年年报显示，中邮系两只基金都重仓其中，双双挤入其前十大流通股股东。数据显示，中邮核心优选目前持有泛海建设2523.89万股，较去年三季度大举增持了1863.16万股，增幅超过了50%以上；中邮核心成长也重仓持有1997.38万股，相比去年三季度增持1129.6万股。中邮系基金的持股量占流通股的比例超过了10%，分别为泛海建设的第二大股东和第三大股东。华发股份年报显示，中邮核心成长同样选择了大举增持。去年四季度，中邮核心成长持有2811.75万股，较去年三季度增持1169.91万股。凭借大幅的吃进，中邮核心成长也成为华发股份的第二大股东和第一大流通股东。另一家地产类上市公司中华企业，中邮核心优选小幅减持46.29万股。不过，其持股数量仍然高达2500万股，仍为公司第二大流通股东。而在今日发布年报的上实发展中，中邮系两只基金又成为公司的前十大流通股股东。除了增持原有的地产股，陆家嘴2008年年报显示，中邮核心优选在去年四季度新进610.82万股，并一举成为该公司的第八大流通股东。地产股反弹 中邮系笑得甜自去年年底以来，国内一些城市的房屋成交量明显出现了回暖迹象。国信证券的报告显示，在过去一周对环渤海、长三角、华南及中西部共十九个重点城市的商品房屋销售情况监测结果表明，各地楼市销量仍然比较畅旺，回暖态势还在进一步延续。地产股销量的回暖，无意推升了地产股的暴涨热情。数据显示，2009年以来，上证指数的涨幅为24.44%，沪深300指数的涨幅为31%，而地产指数同期涨幅已接近44%。华侨城今年以来的涨幅已超过了55%，股价已回到了13元附近。金地集团、招商地产等地产股的涨幅都超过了50%，远远超过同期上证指数和沪深300指数涨幅。地产股的突出表现让埋伏已久的中邮系基金尝到了不小的甜头。数据显示，自年初至本周三，股票型基金净值的平均涨幅为18%，而中邮核心优选的涨幅高达35%，依然在股票型基金中领跑。而中邮核心成长的涨幅超过了27%，位列所有股票型基金的第十二位。相关报道中邮核心优选开放三日给老客户“补仓”机会？日前，中邮基金公司表示，2007年9月13日起，公司暂停了旗下中邮核心优选的日常申购业务。现为满足广大基金持有人的需求，公司决定自2009年3月25日起至2009年3月27日期间，针对既有客户 (即2009年3月23日前，持有过公司旗下基金产品且未注销本公司基金账户的投资者)，恢复该基金产品的日常申购业务。从2009年3月28日起，该基金将继续暂停日常申购业务，在日常申购业务暂停期间，该基金的赎回业务照常办理。市场分析人士指出，很显然，中邮核心优选选择在目前2200点左右打开申购，可以理解为给老基金持有人补仓减少亏损的机会，传递出的信号应该是较为乐观的。不管未来后市会如何演变，至少在中邮基金心里，目前的股指还不是高点。 每经记者 李娜    相关报道：    重仓地产股 中邮系基金赚欢了    泛海建设中邮系基金联袂出击    抄黄木顺的底 中邮系基金介入泛海建设    哈空调中邮系基金大举入驻    基金弃中国远洋登岸 中邮系浮亏18.6亿    中邮系两基金折戟吉恩镍业增发    中邮系两基金上周跌幅最深    基金排名大洗牌 中邮系基金上演过山车,0.6881611347198486
